{
  "protocol": "ai-agent-task-suspension-signal",
  "version": "1.0",
  "signal_id": "sig_20260608_001",
  "issuer": {
    "id": "operator:lab-console",
    "type": "human_operator",
    "display_name": "Lab Console Operator"
  },
  "target_agent": "agent:codex-demo",
  "issued_at": "2026-06-08T17:30:00Z",
  "expires_at": "2026-06-08T18:30:00Z",
  "scope": {
    "type": "task",
    "task_id": "task_42"
  },
  "action": "suspend",
  "reason": {
    "code": "operator_review",
    "detail": "Manual operator review requested before continuing task_42."
  },
  "correlation_id": "corr_task_42_review"
}
